{
  "schema": "rw/1",
  "sim": "study_01",
  "sim_name": "Study 01",
  "run_id": "7d0fcfd5d690",
  "provenance": "visual",
  "engine": "demo",
  "engine_name": "Demo engine",
  "attitude": "scripted_tilt",
  "duration": 10.0,
  "burn_time": 8.49227542,
  "tank": {
    "node": "tank_a",
    "fluid": "n2o",
    "length": 0.4112,
    "od": 0.1524,
    "wall": 0.003,
    "end_cap": "hemispherical",
    "volume": 0.0059994264,
    "fill0": 0.6
  },
  "geometry": {
    "throat_diameter": 0.026159122,
    "exit_diameter": 0.052318244,
    "chamber_diameter": 0.052318244,
    "chamber_length": 0.37324094,
    "convergent_length": 0.0359357985,
    "nozzle_length": 0.0505355431,
    "feed_diameter": 0.01
  },
  "samples": [
    {
      "t": 0.0,
      "tilt_deg": 50.0,
      "specific_force": [
        -6.30359,
        0.0,
        7.51233
      ],
      "relative_flow": 1.0,
      "relative_fill": 1.0,
      "fill_fraction": 0.6
    },
    {
      "t": 0.05,
      "tilt_deg": 50.7846,
      "specific_force": [
        -6.20013,
        0.0,
        7.59794
      ],
      "relative_flow": 0.987025,
      "relative_fill": 0.990291,
      "fill_fraction": 0.594175
    },
    {
      "t": 0.1,
      "tilt_deg": 51.5643,
      "specific_force": [
        -6.09616,
        0.0,
        7.68162
      ],
      "relative_flow": 0.974534,
      "relative_fill": 0.980702,
      "fill_fraction": 0.588421
    },
    {
      "t": 0.15,
      "tilt_deg": 52.3345,
      "specific_force": [
        -5.99236,
        0.0,
        7.76286
      ],
      "relative_flow": 0.962499,
      "relative_fill": 0.971228,
      "fill_fraction": 0.582737
    },
    {
      "t": 0.2,
      "tilt_deg": 53.0902,
      "specific_force": [
        -5.88946,
        0.0,
        7.84122
      ],
      "relative_flow": 0.950893,
      "relative_fill": 0.961866,
      "fill_fraction": 0.57712
    },
    {
      "t": 0.25,
      "tilt_deg": 53.8268,
      "specific_force": [
        -5.78816,
        0.0,
        7.91629
      ],
      "relative_flow": 0.93969,
      "relative_fill": 0.952612,
      "fill_fraction": 0.571567
    },
    {
      "t": 0.3,
      "tilt_deg": 54.5399,
      "specific_force": [
        -5.68919,
        0.0,
        7.98771
      ],
      "relative_flow": 0.928867,
      "relative_fill": 0.943461,
      "fill_fraction": 0.566077
    },
    {
      "t": 0.35,
      "tilt_deg": 55.225,
      "specific_force": [
        -5.59328,
        0.0,
        8.05516
      ],
      "relative_flow": 0.918405,
      "relative_fill": 0.934412,
      "fill_fraction": 0.560647
    },
    {
      "t": 0.4,
      "tilt_deg": 55.8779,
      "specific_force": [
        -5.50113,
        0.0,
        8.11837
      ],
      "relative_flow": 0.90828,
      "relative_fill": 0.925459,
      "fill_fraction": 0.555276
    },
    {
      "t": 0.45,
      "tilt_deg": 56.4945,
      "specific_force": [
        -5.41344,
        0.0,
        8.1771
      ],
      "relative_flow": 0.898478,
      "relative_fill": 0.916601,
      "fill_fraction": 0.549961
    },
    {
      "t": 0.5,
      "tilt_deg": 57.0711,
      "specific_force": [
        -5.33088,
        0.0,
        8.23117
      ],
      "relative_flow": 0.88898,
      "relative_fill": 0.907835,
      "fill_fraction": 0.544701
    },
    {
      "t": 0.55,
      "tilt_deg": 57.6041,
      "specific_force": [
        -5.25408,
        0.0,
        8.2804
      ],
      "relative_flow": 0.879771,
      "relative_fill": 0.899156,
      "fill_fraction": 0.539494
    },
    {
      "t": 0.6,
      "tilt_deg": 58.0902,
      "specific_force": [
        -5.18364,
        0.0,
        8.32468
      ],
      "relative_flow": 0.870836,
      "relative_fill": 0.890564,
      "fill_fraction": 0.534339
    },
    {
      "t": 0.65,
      "tilt_deg": 58.5264,
      "specific_force": [
        -5.12011,
        0.0,
        8.3639
      ],
      "relative_flow": 0.862163,
      "relative_fill": 0.882056,
      "fill_fraction": 0.529233
    },
    {
      "t": 0.7,
      "tilt_deg": 58.9101,
      "specific_force": [
        -5.06399,
        0.0,
        8.398
      ],
      "relative_flow": 0.853739,
      "relative_fill": 0.873628,
      "fill_fraction": 0.524177
    },
    {
      "t": 0.75,
      "tilt_deg": 59.2388,
      "specific_force": [
        -5.01572,
        0.0,
        8.42692
      ],
      "relative_flow": 0.84555,
      "relative_fill": 0.86528,
      "fill_fraction": 0.519168
    },
    {
      "t": 0.8,
      "tilt_deg": 59.5106,
      "specific_force": [
        -4.97569,
        0.0,
        8.45061
      ],
      "relative_flow": 0.837587,
      "relative_fill": 0.857008,
      "fill_fraction": 0.514205
    },
    {
      "t": 0.85,
      "tilt_deg": 59.7237,
      "specific_force": [
        -4.94422,
        0.0,
        8.46906
      ],
      "relative_flow": 0.829841,
      "relative_fill": 0.84881,
      "fill_fraction": 0.509286
    },
    {
      "t": 0.9,
      "tilt_deg": 59.8769,
      "specific_force": [
        -4.92156,
        0.0,
        8.48225
      ],
      "relative_flow": 0.8223,
      "relative_fill": 0.840686,
      "fill_fraction": 0.504411
    },
    {
      "t": 0.95,
      "tilt_deg": 59.9692,
      "specific_force": [
        -4.90789,
        0.0,
        8.49017
      ],
      "relative_flow": 0.814955,
      "relative_fill": 0.832632,
      "fill_fraction": 0.499579
    },
    {
      "t": 1.0,
      "tilt_deg": 60.0,
      "specific_force": [
        -4.90333,
        0.0,
        8.49281
      ],
      "relative_flow": 0.807799,
      "relative_fill": 0.824647,
      "fill_fraction": 0.494788
    },
    {
      "t": 1.05,
      "tilt_deg": 59.9692,
      "specific_force": [
        -4.90789,
        0.0,
        8.49017
      ],
      "relative_flow": 0.800824,
      "relative_fill": 0.816729,
      "fill_fraction": 0.490037
    },
    {
      "t": 1.1,
      "tilt_deg": 59.8769,
      "specific_force": [
        -4.92156,
        0.0,
        8.48225
      ],
      "relative_flow": 0.794022,
      "relative_fill": 0.808877,
      "fill_fraction": 0.485326
    },
    {
      "t": 1.15,
      "tilt_deg": 59.7237,
      "specific_force": [
        -4.94422,
        0.0,
        8.46906
      ],
      "relative_flow": 0.787385,
      "relative_fill": 0.801089,
      "fill_fraction": 0.480653
    },
    {
      "t": 1.2,
      "tilt_deg": 59.5106,
      "specific_force": [
        -4.97569,
        0.0,
        8.45061
      ],
      "relative_flow": 0.780907,
      "relative_fill": 0.793363,
      "fill_fraction": 0.476018
    },
    {
      "t": 1.25,
      "tilt_deg": 59.2388,
      "specific_force": [
        -5.01572,
        0.0,
        8.42692
      ],
      "relative_flow": 0.774583,
      "relative_fill": 0.785699,
      "fill_fraction": 0.471419
    },
    {
      "t": 1.3,
      "tilt_deg": 58.9101,
      "specific_force": [
        -5.06399,
        0.0,
        8.398
      ],
      "relative_flow": 0.768406,
      "relative_fill": 0.778094,
      "fill_fraction": 0.466856
    },
    {
      "t": 1.35,
      "tilt_deg": 58.5264,
      "specific_force": [
        -5.12011,
        0.0,
        8.3639
      ],
      "relative_flow": 0.76237,
      "relative_fill": 0.770547,
      "fill_fraction": 0.462328
    },
    {
      "t": 1.4,
      "tilt_deg": 58.0902,
      "specific_force": [
        -5.18364,
        0.0,
        8.32468
      ],
      "relative_flow": 0.75647,
      "relative_fill": 0.763057,
      "fill_fraction": 0.457834
    },
    {
      "t": 1.45,
      "tilt_deg": 57.6041,
      "specific_force": [
        -5.25408,
        0.0,
        8.2804
      ],
      "relative_flow": 0.750702,
      "relative_fill": 0.755623,
      "fill_fraction": 0.453374
    },
    {
      "t": 1.5,
      "tilt_deg": 57.0711,
      "specific_force": [
        -5.33088,
        0.0,
        8.23117
      ],
      "relative_flow": 0.74506,
      "relative_fill": 0.748243,
      "fill_fraction": 0.448946
    },
    {
      "t": 1.55,
      "tilt_deg": 56.4945,
      "specific_force": [
        -5.41344,
        0.0,
        8.1771
      ],
      "relative_flow": 0.739539,
      "relative_fill": 0.740917,
      "fill_fraction": 0.44455
    },
    {
      "t": 1.6,
      "tilt_deg": 55.8779,
      "specific_force": [
        -5.50113,
        0.0,
        8.11837
      ],
      "relative_flow": 0.734135,
      "relative_fill": 0.733643,
      "fill_fraction": 0.440186
    },
    {
      "t": 1.65,
      "tilt_deg": 55.225,
      "specific_force": [
        -5.59328,
        0.0,
        8.05516
      ],
      "relative_flow": 0.728844,
      "relative_fill": 0.72642,
      "fill_fraction": 0.435852
    },
    {
      "t": 1.7,
      "tilt_deg": 54.5399,
      "specific_force": [
        -5.68919,
        0.0,
        7.98771
      ],
      "relative_flow": 0.723663,
      "relative_fill": 0.719247,
      "fill_fraction": 0.431548
    },
    {
      "t": 1.75,
      "tilt_deg": 53.8268,
      "specific_force": [
        -5.78816,
        0.0,
        7.91629
      ],
      "relative_flow": 0.718587,
      "relative_fill": 0.712123,
      "fill_fraction": 0.427274
    },
    {
      "t": 1.8,
      "tilt_deg": 53.0902,
      "specific_force": [
        -5.88946,
        0.0,
        7.84122
      ],
      "relative_flow": 0.713613,
      "relative_fill": 0.705047,
      "fill_fraction": 0.423028
    },
    {
      "t": 1.85,
      "tilt_deg": 52.3345,
      "specific_force": [
        -5.99236,
        0.0,
        7.76286
      ],
      "relative_flow": 0.708737,
      "relative_fill": 0.698018,
      "fill_fraction": 0.418811
    },
    {
      "t": 1.9,
      "tilt_deg": 51.5643,
      "specific_force": [
        -6.09616,
        0.0,
        7.68162
      ],
      "relative_flow": 0.703957,
      "relative_fill": 0.691036,
      "fill_fraction": 0.414622
    },
    {
      "t": 1.95,
      "tilt_deg": 50.7846,
      "specific_force": [
        -6.20013,